Категория,Вопрос,Ответ
ЕГЭ и вступительные,"Если у меня есть уважительная причина, по которой я не могу попасть на вступительные, смогу ли я написать экзамен в другое время?",График проведения вступительных испытаний будет сформирован индивидуально для каждого поступающего в личном кабинете абитуриента после одобрения заявления о приеме.
Иностранным студентам,"Я иностранный абитуриент, могу ли поступить по квоте?","Да, информацию можно найти на сайте УрФУ: “Абитуриентам” –> “Иностранным гражданам”"
Иностранным студентам,"Как поступить в вуз, если я из стран СНГ?",Информацию можно найти на сайте УрФУ: “Абитуриентам” –> “Иностранным гражданам”
Иностранным студентам,Будут ли выездные комиссии и когда?,В зависимости от эпидемиологической ситуации вступительные испытания будут проводиться в очном либо дистанционном формате. График проведения вступительных испытаний будет сформирован индивидуально для каждого поступающего в личном кабинете абитуриента после одобрения заявления о приеме.
Иностранным студентам,Могу ли я на заочке заниматься внеучебной деятельностью? ,"Да, но все зависит от организации, в которую вы хотите попасть."
Иностранным студентам,Кто такой наставник? Как стать наставником? ,"Наставники – это студенты старших курсов, которые помогают в адаптации первокурсникам. Каждый год в институтах объявляется набор в наставники, вы можете подать заявку и пройдя отбор, стать наставником."
Иностранным студентам,Нужно ли платить если я вступлю в какую-нибудь организацию?,"Вы платите ежемесячный взнос для того, чтобы стать членом Союза Студентов в УрФУ. Почти вся внеучебная деятельность проходит в рамках деятельности Союза. "
Иностранным студентам,Внеучебка влияет на рейтинг?,"Да, влияет. Чем активнее вы проявляйте себя во вне учебной деятельности, тем больше баллов она добавляет вам в общий рейтинг. "
Иностранным студентам,Какие дополнительные активности есть в университете? Чем там можно заниматься? ,"Вступить в Союз Студентов УрФУ и выбрать деятельность по душе! Можно вступить в студенческий медиацентр, фотоклуб, клуб иностранных языков. Также есть спортивные секции, творческие коллективы и студ. отряды."
Иностранным студентам,Как попасть в спортивную команду института?,"Вы сможете стать участником спортивной команды университета, связавшись с тренером и пройдя отбор. Подробнее: https://sport.urfu.ru/activity/ "
Иностранным студентам,Что такое профсоюзы? Как туда попасть? Чем они занимаются?,"Профсоюзная организация студентов (Союз студентов) УрФУ — команда, создающая образовательные и развлекательные проекты для таких же учащихся. Вся деятельность союза направлена на управление и развитие студенческих коллективов и инициатив. Поселение, социальная поддержка, спорт, развитие дополнительных компетенций и успешное трудоустройство — все это создано общими усилиями студенческого профсоюза. Чтобы вступить в профсоюз необходимо заполнить заявление о вступлении и внести профсоюзный взнос."
Иностранным студентам,"Могу ли я уезжать на соревнования, будет ли это мешать учебе?","Об этом нужно будет оповестить деканат и преподавателей. Ситуация может решиться по-разному — преподаватель может попросить досдать необходимые контрольные и самостоятельные работы после возвращения с соревнований. Если соревнования выпадут на время сессии, то также важно заранее договориться с деканатом и преподавателями на досрочную сдачу экзаменов и зачетов."
Иностранным студентам,Есть ли смысл вступать в союз студентов? Какие от этого плюсы? ,"Союз студентов – самая большая студенческая организация УрФУ. Ее деятельность затрагивает все грани студенческой жизни. Союз студентов реализует образовательные, развлекательные, спортивные, творческие, карьерные проекты. И каждый день эта организация делает  жизнь в УрФУ лучше и лучше! Также профсоюзный билет дает множество скидок и возможность получить материальную помощь."
Общежития,Предоставляется ли общежитие на время поступления (вступительных испытаний)? ,Да
Общежития,Легко попасть в общежития? Всех ли заселяют? Влияют на это баллы егэ? Далеко общежитие от института? ,В общежития УрФУ первокурсников заселяют на основании баллов ЕГЭ и количества мест в квоте института. При этом особые категории граждан обязательны к поселению.  Общежития находятся в шаговой доступности от университета.
Общежития,На сколько лет я могу получить общежитие?,"Общежитие можно получить на весь период обучения, если соблюдать правила проживания, закрывать сессии без долгов и заниматься внеучебной деятельностью."
Общежития,Из-за чего могут выселить из общежития?,"Из-за нарушения правил проживания в общежитии, нарушения устава университета, нарушений проходящие через службу безопасности университета, нарушения контрольно-пропускного режима."
Общежития,Примерная стоимость общежития?,Стоимость за месяц проживания составит примерно 800-1000 рублей.
Общежития,Нужна ли для заселения справка 086?,"Да, при этом, если вы проходите медкомиссию по месту жительства, необходимо будет заверить вашу пройденную комиссию в поликлинике на Комсомольской, 59."
Общежития,Сколько людей в комнатах живут в общежитии?,"По разному, в зависимости от размера комнаты. Чаще всего, это комнаты на 3-4 человека. Комнаты на 2 человека в 95%  случаев предоставляются студентам, выполняющим дипломные работы (бакалавриат - 4 курс, специалитет - 5 курс, магистрам 1 и 2 года обучения)."
Учеба,Обязательно ли проходить медосмотр каждый год?,"Да, это необходимо для определения группы на физкультуре и каких-либо отклонений."
Учеба,"Как получить справку о том, что я студент?",В деканате Вашего института или заказать ее через Личный кабинет студента.
Учеба,Как проходит заочная форма обучения? И сколько она длится по времени?,"Здравствуйте! Заочная форма обучения предполагает самостоятельное изучение дисциплин и очное присутствие студента только в период аттестационной сессии. Всё зависит от выбранного Вами направления, подронее можно посмотреть в направлениях подготовки или обратиться к руководителю образовательной программы. Стоимость можно посмотреть в приказе о стоимости обучения."
Учеба,"Что делать, если со мной не связался наставник?","Вам необходимо написать в сообщения сообщества того института, куда вы поступили."
Учеба,Когда появляется расписание занятий? ,С расписанием занятий можно будет ознакомиться в последнюю неделю августа либо в начале сентября.
Учеба,Где я могу оплатить обучение? ,Обучение можно оплатить двумя способами: лично в кассе университета либо через Сбербанк.Онлайн.
Учеба,"Что будет, если потерять студенческий/пропуск общаги? ","Нужно будет восстанавливать документы, также вам сделают запись в личное дело за утерю документов."
Учеба,На факультете можно выбирать иностранный язык?,"Зависит от вашего направления подготовки, на некоторых факультетах допускается выбор основного иностранного языка."
Учеба,Какое направление будет записано в дипломе?,"В дипломе будет обозначено присвоение  вам конкретной квалификации и присвоения вами область знаний. Так, чтобы точно понять, что у вас будет записано, стоит обратить внимание на код вашей специализации. "
Учеба,Как рассчитывается БРС?,"БРС – балльно-рейтинговая система, максимальное значение и наивысшая оценка в которой – 100. По сути, почти любой предмет делится на два блока : лекционные занятия, куда входит и итоговая аттестация, и практические – за каждый вы можете получить определенное количество баллов, обусловленное коэффициентом. Например, коэффициент  блока 0.4, то у второго – 0.6. И если вы в первом блоке  получаете 89 баллов, то ваш итоговый результат будет 89/0.4 = 35.6 Если за второй блок вы получите 100, то итоговый – 100/0.6=60 И итоговая сумма баллов выходит 60+35.5=95.5"
Учеба,Можно ли взять академический отпуск?,"Можно, если ваша ситуация подходит под одну из описанных здесь: https://urfu.ru/fileadmin/user_upload/common_files/academic_council/Polozhenie_ob_akademicheskom_otpuske.docx "
Учеба,В каком корпусе  я буду учиться?,"Зависит от направления подготовки. Большинство корпусов находятся рядом с ГУКом - главным зданием, на ул.Мира 19. Иногда занятия могут проходить на Тургенева, Куйбышева, Ленина, Чапаева и Гоголя."
Учеба,Как выбрать физ-ру?,"После того, как у вас появится доступ в личном кабинете студента. Как правило выбор открывается в сентябре, после первой ознакомительной лекции. "
Учеба,На физ-ру можно не ходить?,Физкультура – такой же предмет как и все остальные. Все зависит от преподавателя и вашего отношения к посещению предмета
Учеба,Есть ли отработки?,Нет
Учеба,Сколько всего пар в неделю?,Зависит от направления. Как правило от двух пар шесть раз в неделю. 
Учеба,"Как и где узнать, какие конкретно специальности подготавливает то или иное направление/факультет?",На сайте представлена подробная информация: https://urfu.ru/ru/applicant/docs-abiturient/programs/
Учеба,"Чем ВУЗ отличается от других, какие у него есть особенности? ","Уральский федеральный университет — один из ведущих вузов России. Сегодня в вузе учится 36 000 студентов под руководством 4 000 преподавателей. Всего в Уральском федеральном 14 учебных зданий и 16 общежитий, два из которых совершенно новые, а строительство еще одного началось этой зимой. Есть спортивные объекты, где студенты не только занимаются физкультурой, но и тренируются в свободное время. Если говорить о позициях университета в стране и мире, то по всем направлениям подготовки среди российских вузов по рейтингу издания Forbes УрФУ находится на 4 месте. УрФУ на 2 месте в рейтинге RAEX по востребованности университетов российской экономикой и на 8 месте по востребованности выпускников у работодателей. Вы можете выбрать любую из более чем 300 образовательных программ по пяти укрупненным блокам: информационные технологии, социогуманитарные науки и технологии, инженерные науки, естественные науки и математика, экономика и управление.  Талантливые студенты УрФУ могут рассчитывать на повышенные стипендии. Победители и призеры олимпиад, а также высокобалльники по результатам ЕГЭ получают стипендии до 30 000 рублей с первого месяца обучения. Студенты могут всесторонне развиваться: в спорте, творчестве и науке. В вузе действуют десятки внеучебных организаций, где каждый сможет найти себе дело по душе или открыть в себе новые таланты. В числе лидеров — Союз студентов УрФУ, крупнейший в регионе волонтерский центр «Волонтеры Урала», центр творчества студентов и многие другие."
Учеба,Существуют ли программы обмена в другие страны? С какими университетами сотрудничает УрФУ?,"Да, в УрФУ существует программа международного студенческого обмена. Подробнее можно посмотреть информацию здесь: https://urfu.ru/ru/international/mobility/ "
Учеба,Чего следует  ожидать от первой сессии? ,"Кому-то этот период дается легко, кому-то – не очень. Сдав свою первую сессию, первокурсники становятся на шаг ближе к званию настоящего студента. Ее не стоит бояться, но отнеситесь к ней ответственно, тогда у вас все получится!"
Учеба,С какого курса начинаются предметы по специализации? Где можно найти список всех дисциплин на изучаемом факультете?,"У каждого направления предметы по специализации начинаются по-разному. Кто-то начинает изучать специализированные предметы с первого курса, кто-то получает такие знания со второго. Чаще всего только специализированные предметы стартуют с третьего курса. Список всех изучаемых дисциплин можно посмотреть в каталоге образовательных программ УрФУ во вкладке «Документы»."
Учеба,"Если мне нельзя заниматься физкультурой, как быть?",В УрФУ возможен выбор модуля и категории Физической Культуры.
Учеба,Смогу ли я позже перевестись с коммерции на бюджет?,"При наличии вакантных бюджетных мест можно перевестись, подробнее посмотрите на сайте студентам- перевод и восстановление или позвоните Ответственному от институтов УрФУ за перевод и восстановление студентов."
Учеба,"Можно ли как-то посмотреть, как выглядит вуз внутри?","Да, для этого университет разработал виртуальные туры: https://urfu.ru/ru/about/online-museum/ "
Учеба,На практику устраивает вуз или придется искать ее самостоятельно?,"Университет активно помогает с поиском практики для студентов. У вуза налажены контакты со множеством партнеров и работодателей как города, так и области."
Учеба,Как я свяжусь со своей группой перед началом пар?,"После появления приказов о зачислении с вами свяжутся наставники направления, на которое вы поступили. Если появятся какие-либо вопросы вы можете обратиться в отборочную комиссию вашего института."
Учеба,Кто-то поможет нам адаптироваться к учебе?,"Наставники – ваши проводники в студенческой жизни. Они будут помогать вам влиться в университетскую рутину, а также ответят на все ваши вопросы."
Учеба,Есть ли военная кафедра? Как на нее поступить? Что она дает?,"Да при университете работает военно-учебный центр (ВУЦ), который осуществляет подготовку офицерских кадров — сержантов и лейтенантов запаса. Поступить на нее можно начиная со второго курса очной формы обучения. Для участия в конкурсном отборе нужно подать заявление, подать необходимые документы и пройти медкомиссию. Во время конкурсного отбора анализируются заключение медкомиссии, успеваемость за первый курс и результаты нормативов (подтягивания, бег на 100 и 3000 метров)."
Учеба,"Если я поступлю на одну специальность, могу ли я со второго семестра перевестись на другую?","Да, перевод возможен, но при наличии мест, также нужно будет закрыть академическую разницу."
Учеба,Что такое БРС?,"Балльно-рейтинговая система. Это система оценивания студентов во время обучения в семестре и на сессии. Как правило, оценка за предмет является средним арифметическаим между работой в семестре и ответом на экзамене."
Учеба,Какие самые топовые специальности в вузе?,"Все специальности в УрФУ прекрасны по-своему, важно определиться, что нравится вам больше всего, и чем в будущем вы хотите заниматься."
Учеба,Смогу ли я совмещать учебу и работу? ,"Все зависит от ваших возможностей, специальности и профессии, но есть множество примеров, когда наши студенты совмещают работу и учебу, многие также работают в университете."
