Категория,Вопрос,Ответ
Поступление,Учитывается ли средний балл аттестата? Как?,"Средний балл аттестата учитывается при ранжировании поступающих на этапе зачисления (V глава, п. 1.6). Также за аттестат с отличием дополнительно присваиваются 3 балла в качестве индивидуального достижения."
Поступление,После СПО есть возможность поступить на бюджет?,"Выпускники с дипломом СПО участвуют в конкурсе наравне с выпускниками школ на всех направлениях. Для участия в конкурсе необходимо будет подать документы в приемную комиссию и сдать вступительные испытания (если не записались на сдачу ЕГЭ вместе со школьниками), проводимые в УрФУ, после чего получите общую сумму баллов за вступительные испытания и будете числиться в списках поступающих."
Поступление,Можно ли изменить выбор образовательных программ до зачисления на бакалавриат на бюджет?,"Да, но только до 26 июля (по результатам ЕГЭ), до 17 июля (по вступительным испытаниям)."
Поступление,Можно ли подавать документы и на бюджет и на контракт? Что нужно сделать?,"Да можно. Для этого в заявлении поставить галочку и на бюджет, и на контракт."
Поступление,Можно ли поступить в магистратуру после специалитета?,"Можно, зависит от направления подготовки, по которому было получено высшее образование."
Поступление,Какой конкурс (человек/место) был в прошлом году? А в этом году? ,"Информации о проходных баллах не публикуется отдельным списком на сайте УрФУ. Можно посмотреть приказы и о зачислении 2020 года, там указаны баллы, с которыми были зачислены на бюджет абитуриенты. "
Поступление,Будут ли еще дни открытых дверей? ,Информация об онлайн-консультациях доступна в группе «Хочу в УрФУ»
Поступление,Учитывается ли сочинение? Как? ,Сочинение не учитывается
Поступление,Обязательно ли проходить медосмотр перед поступлением?,"Медосмотр перед поступлением обязателен, если вы поселяетесь в общежитие. На некоторые направления есть медицинские ограничения, отсутствие которых подтверждается справкой 086. Медосмотр для занятий физкультурой вы пройдете в первые месяцы учебы"
Поступление,"Какие должны быть мои дальнейшие действия, после того как я увидела себя в приказе о зачислении?","Поздравляем! Вы поступили в наш университет. Далее с вами должен связаться ваш наставник, который добавит вас в вашу академическую группу. Он расскажет вам, куда будет необходимо прийти 1 сентября."
Поступление,На сколько направлений можно подать документы в вуз?,В 2021 году можно подать на 7 направлений подготовки в вузе.
Поступление,"Что будет, если согласие на зачисление предоставить в последний день? Его успеют рассмотреть или я выпаду из конкурса?","Все заявления, которые будут отправлены в срок, будут рассмотрены."
Поступление,"Если я отзову согласие на зачисление, а потом передумаю, но до конца дедлайна по его предоставлению, я могу его загрузить обратно?","Да, можете."
Поступление,"Как я могу узнать, что точно зачислена на контракт, если количество мест там тоже ограничено?","Зачисление на контракт происходит после оплаты обучения — полного или частичного. Не обязательно дожидаться приказа о зачислении. Чаще всего количество мест на контракте — это условная величина, на нее не стоит ориентироваться при выборе направления подготовки."
Поступление,"Если у меня и еще кого-то будет одинаковое количество баллов, как будут выбирать того, кто поступит?",Будут смотреть по среднему баллу аттестата.
Поступление,Для чего нужны фотографии при подаче документов? ,"Фотографии идут в личное дело, на пропуск в общежитие и т.д."
Поступление,Что такое согласие на зачисление? Его нужно писать на каждое направление?,"Заявление о согласии на зачисление - документ, который показывает, куда хочет быть зачисленным абитуриент. Абитуриент вправе подать в один и тот же вуз не более двух согласий о зачислении. Так что стоит хорошо подумать перед тем, чтобы писать согласие на то или иное направление."
Поступление,Могу ли я подать документы и сдать вступительные онлайн?,"Да, такая возможность предусмотрена правилами приема."
Поступление,Когда можно подать документы на поступление? В каком пункте прописаны даты завершения приема документов?,Прием документов начинается 17 июня. Остальные даты приема 2021 можно посмотреть в календаре приема https://urfu.ru/ru/applicant/docs-abiturient/kalendar-priema/
Поступление,Какие документы нужны при поступлении? А если я еще и льготу имею? ,"Перечень документов для всех групп поступающих указан в разделе 2, пункте 2 правил приема 2021."
Поступление,На какие специальности нужно подать еще и ксерокопию мед. справки? Какой формы необходима мед.справка?,"Форма справки 086У 11.05.02. «Радиоэлектронные системы и комплексы» 13.03.01. «Теплоэнергетика и теплотехника» 13.03.02. «Электроэнергетика и электротехника» 30.05.01. «Медицинская биохимия» 30.05.02. «Медицинская биофизика» 30.05.03. «Медицинская кибернетика» 14.03.02. «Ядерные физика и технологии» 14.05.01. «Ядерные реакторы и материалы» 14.05.02. «Атомные станции: проектирование, эксплуатация и инжиниринг» 14.05.03. «Технологии разделения изотопов и ядерное топливо» 14.05.04. «Электроника и автоматизация физических установок» 20.05.01. «Пожарная безопасность» 23.03.02. «Наземные транспортно-технологические комплексы» 23.03.03. «Эксплуатация транспортно-технологических комплексов» 23.05.02. «Транспортные средства специального назначения»"
Поступление,Как и где подать документы для поступления? ,"Лично по адресу ул. Мира 19 (при благоприятной эпид обстановке), по почте или в электронном виде через личный кабинет абитуриента или портал Госуслуг"
Поступление,"Обязательно ли подавать заявление о согласии на зачисление, если оригинал аттестата (диплома) уже предоставлен в университет?","Обязательно подать заявление о согласии на зачисление (до 28 июля 18:00 этап приоритетного зачисления, до 3 августа 18:00 этап зачисления на основные конкурсные места), иначе абитуриент зачислен не будет."
Поступление,"Если подавать документы в вуз на несколько факультетов, то нужен один комплект документов или несколько?",Один пакет.
Поступление,"Если мне нет 18 лет, могу ли я подавать документы без родителей? Нужно ли какое-либо их согласие?","Поступающим самостоятельно (нет 18 лет) необходимо распечатать форму заявления из раздела ""Абитуриенту"" - ""Подать документы почтой"" - ""Заявление: согласие родителей на обработку персональных данных""."
Поступление,Как вообще сканировать аттестат? Все страницы? А корочку надо? А удостоверение к медали?,"Необходимо сканировать страницы, где указана фамилия, имя, серия и номер аттестата, а также вкладыш с оценками. Корочку сканировать не надо. У удостоверения необходимо сканировать только внутреннюю часть."
Поступление,На какой курс можно поступить в вуз после колледжа? ,Поступление возможно только на 1 курс. Далее возможен перевод на ускоренную форму обучения для окончивших колледж и поступивших на смежную специальность. Ускоренная форма есть только по заочной форме и только по контракту.
Поступление,Влияет ли моя специальность в колледже на поступление в УрФУ?,На само поступление специальность не влияет.
Поступление,Как осуществляется распределение мест относительно льготной категории граждан?,"Льготная категория зачисляется в нулевую волну, самой первой."
Поступление,Как поступить с помощью целевого?,"Для этого заранее нужно договориться с предприятием, которая оплатит ваше целевое обучение. Между вузом, организацией и вами заключается трехсторонний договор. Подробности можно узнать здесь: https://urfu.ru/ru/applicant/priem-na-celevoe-obuchenie/ "
Поступление,Какую математику нужно сдавать на мою программу — профильную или базовую?,"На все программы обучения УрФУ сдается базовая математика. Профильная сдается на определенные программы, с ними можно ознакомиться в списке программ обучения."
Поступление,Рассматривается ли портфолио?,Портфолио может быть рассмотрено на некоторых направлениях с экзаменом творческой или профессиональной направленности.
Стипендии и скидки,Можно ли иметь стипендию на платном?,"Можно, если вы относитесь к категории лиц, претендующих на социальную помощь. Также студентам-контрактникам доступен ряд именных стипендий за успехи в учебе, науке или общественной деятельности"
Стипендии и скидки,Как повысить стипендию?,"Повышенную стипендию можно получить если вы: а. Талантливый первокурсник и у вас имеется то количество баллов ЕГЭ, за которые назначается повышенная стипендия(в 2020 году это были 280 б. на гуманитарные специальности, и 270 на естественно-технические); б. Отличник учебы; в. Лидер внеучебного рейтинга; г. Относитесь к категориям малоимущих граждан и граждан, которым полагается соц. помощь."
Стипендии и скидки,Как получить скидку?,"Скидка за обучение зависит от количество баллов ЕГЭ, с которыми вы поступаете, или от вашей учебы в течение года. Чем выше итоговый балл в семестре – тем выше вероятность получить скидку или перейти на бюджет. "
Стипендии и скидки,"Есть ли скидки для платников? Если да, то какие? ","Да, есть. Зависит от суммы баллов ЕГЭ  – до 40,%  – и от дальнейшего обучения. Чем выше ваш учебный рейтинг – тем больше вероятность получить хорошую скидку или перевестись на бюджет."
Стипендии и скидки,"В одном из институтов были гранты на обучение, в 2021 году они останутся?","Да, гранты есть в двух институтах: Уральский гуманитарный институт и институт экономики и управления. "
Стипендии и скидки,"Какие стипендии можно получать сразу, поступив на первый курс?",Информация о стипендиях здесь: https://urfu.ru/ru/students/study/scholarships/
Стипендии и скидки,Можно ли подавать заявления до результатов ЕГЭ?,Да.
Стипендии и скидки,Сколько бюджетных мест?,В новом учебном году число бюджетных мест будет рекордно увеличено — 7494 по всем уровням и формам обучения.
ЕГЭ и вступительные,"Можно ли в УрФУ сдать дополнительно предметы, по которым не сдавал ЕГЭ? ","Нет, нельзя. Если абитуриент поступает по результатам ЕГЭ после 11 класса, то он не может сдать дополнительные недостающие предметы."
ЕГЭ и вступительные,Результаты ЕГЭ какого года действуют в этом году? ,"Результаты ЕГЭ, полученные за период: 2017-2021. "
ЕГЭ и вступительные,Где смотреть место и дату вступительных экзаменов? А компьютерных тестирований?,"На сайте, расписание вступительных испытаний будет опубликовано не позднее 1 июня."
ЕГЭ и вступительные,В какой форме проводятся вступительные испытания для получения второго высшего образования?  ,"Вступительные испытания согласно перечню вступительных испытаний, указанных на данное направление подготовки, в форме тестирования-собеседования."
ЕГЭ и вступительные,На какие направления нужно пройти творческое/профессиональное испытание? ,"Архитектура, Технология художественной обработки материалов, Журналистика, Телевидение, Филология, Физическая культура,  История искусств, Дизайн, Медиакоммуникации, Адаптивная физическая культура."
ЕГЭ и вступительные,Магистратура. Какие вступительные и в какой форме проходят? ,"Вступительные испытания проходят в форме компьютерного тестирования. Ознакомиться с программой вступительного испытания можно здесь https://magister.urfu.ru/ru/programs/ , выбрав конкретное направление подготовки. "
ЕГЭ и вступительные,Могут ли вступительные испытания проводиться с использованием дистанционных технологий? ,"Могут, при условии идентификации поступающего при сдаче им вступительных испытаний."
ЕГЭ и вступительные,Где можно посмотреть минимальные баллы ЕГЭ и вступительных испытаний? ,Минимальные баллы на предметы ЕГЭ и ВИ можно посмотреть на сайте УрФУ в разделе «Абитуриенту» - «Минимальные вступительные баллы в 2021 году» или в «Направлениях подготовки».
ЕГЭ и вступительные,Могу  ли  я подавать документы если баллов ЕГЭ меньше проходных?,"Нет, сумма ваших баллов должна быть равна или превышать те баллы, которые указаны на сайте направления. "
ЕГЭ и вступительные,Как готовиться к вступительному творческому испытанию?,"Информация о форме вступительных испытаниях доступна на сайте направления. Также можно посмотреть записи Дней открытых дверей, где преподаватели своих направлений дают рекомендации к подготовке."
ЕГЭ и вступительные,Будут ли в этом году курсы по подготовке к егэ?,"Будут, подробности на сайте: https://urfu.ru/ru/school/podgotovitelnye-kursy/ "
ЕГЭ и вступительные,"Если мне нужно сдавать вступительные, и я не успеваю / не могу сдать их в назначенное время, можно ли это сделать в резервные дни? Если совпадает несколько вступительных экзаменов и на некоторые нет резервов, как быть?","Да, можно сделать в резервные дни. Если совпадают несколько экзаменов и нет резервных мест, тогда лучше уточнить данный вопрос у ответственных отборочной комиссии, их номера можно найти здесь: https://urfu.ru/ru/applicant/contacts/ "
ЕГЭ и вступительные,Нужно ли сдавать ЕГЭ после СПО?,"После выпуска из колледжа или техникума абитуриент проходит вступительные испытания, проводимые УрФУ. ЕГЭ при этом сдавать не обязательно."
ЕГЭ и вступительные,Могу ли я сдать ЕГЭ на базе УрФУ?,Вы можете сдать вступительные экзамены внутри университета.  ЕГЭ университет не проводит.
ЕГЭ и вступительные,"Я окончил колледж, надо ли мне сдавать ЕГЭ? ","Абитуриенты, поступающие в университет на базе среднего профессионального образования, могут сдавать вступительные испытания в УрФУ и в форме ЕГЭ, и в форме компьютерного или бланкового тестирования. У лиц, поступающих по результатам ЕГЭ, нет привилегий по отношению к лицам, поступающим по результатам вступительных испытаний. Обе категории участвуют в общем конкурсе."
ЕГЭ и вступительные,Где я могу посмотреть демо-версии вступительных экзаменов?,"С программами вступительных испытаний вы можете ознакомиться в разделе «Программы вступительных испытаний, проводимых вузом самостоятельно, для поступления на программы ВО». Демо-варианты будут на той же странице сайта, где программы, в марте 2021 года."
ЕГЭ и вступительные,"Могу ли я вместо ЕГЭ поступить по вступительным, если поступаю после 11 класса?","Нет, после 11 класса можно поступить в вуз только по ЕГЭ"
ЕГЭ и вступительные,"Если у меня нет одного предмета ЕГЭ, можно ли мне сдать его в вузе?",Можно записаться на сдачу дополнительного предмета в формате ЕГЭ в следующем году
ЕГЭ и вступительные,"Если я сдам в качестве вступительного испытания, например, русский язык на одно направление, эти баллы учитываются, если я отнесу документы на другое?","Вступительные экзамены не пересдаются, следовательно баллы учитываются."
